"Name","Internal name","Type","Description","Group name","Form field","Options","Read only value","Read only definition","Calculated","External options","Deleted","HubSpot defined","Created user","Usages","Fill rate","Last Updated Time","Update Source"
"Call and meeting type","hs_activity_type","enumeration","The activity type of the engagement","engagement","false","Sales - Cold Call; Sales - Discovery; Sales - Demo; Sales - Follow Up; Sales - Negotiation; Sales - Other; LS - Executive Onboarding; LS - Technical Onboarding 1; LS - Studio Tour; LS - Goal Setting; LS - Performance Reviews; LS - Check-in; LS - Support; LS - F2F; Sales - In-Person; MP - Speaking Engagement","false","true","false","false","false","true","HubSpot","Automation platform flow (3); Report (13); Sales view (5)","50.47%","",""
"Attached file IDs","hs_attachment_ids","enumeration","The IDs of the files that are attached to the engagement","engagement","false","","false","true","false","true","false","true","HubSpot","","0.01%","",""
"Activity created by","hs_created_by","number","The user who created the engagement","engagement","false","","true","true","false","true","false","true","HubSpot","Report (1)","96.95%","",""
"Create date","hs_createdate","datetime","The date that an engagement was created","engagement","false","","true","true","false","false","false","true","HubSpot","Rollup property (3); Inbounddb lists (1); Automation platform flow (5); Report (21); Dataset (3); Sales view (5)","100%","",""
"Last modified date","hs_lastmodifieddate","datetime","The date any property on this engagement was modified","engagement","false","","true","true","false","false","false","true","HubSpot","","100%","",""
"Activity date","hs_timestamp","datetime","The date that an engagement occurred","engagement","false","","false","true","false","false","false","true","HubSpot","Rollup property (5); Report (7); Sales view (3); Dashboard (1)","100%","",""
"Activity assigned to","hubspot_owner_id","enumeration","The user that the activity is assigned to in HubSpot. This can be any HubSpot user or Salesforce integration user, and can be set manually or via Workflows.","engagement","false","","false","true","false","true","false","true","HubSpot","Inbounddb lists (1); Automation platform flow (1); Report (41); Sales view (8); Dashboard (1)","100%","",""
"HubSpot Team","hubspot_team_id","enumeration","The team of the owner of an engagement.","engagement","false","","true","true","false","true","false","true","HubSpot","Report (11)","78.66%","",""
"Talking points","talking_points","enumeration","","engagement","true","America Prays 250; NRB 2026; PRAY Science (Pray Science)","false","false","false","false","false","false","Nay Luchetti","Report (4); Sales view (3)","1.37%","",""
"Associated company open deal amount","associated_company_open_deal_amount","number","","meeting","false","","true","false","true","false","false","false","Nay Luchetti","Sales view (1)","12.9%","",""
"Associated contact first conversion","associated_contact_first_conversion","string","","meeting","false","","true","false","true","false","false","false","Nay Luchetti","Sales view (1)","34.96%","",""
"Associated contact source drill down","associated_contact_source_drill_down","string","","meeting","false","","true","false","true","false","false","false","Nay Luchetti","","81.25%","",""
"HubSpot attendee owner IDs","hs_attendee_owner_ids","enumeration","Stores the owner ids of any attendees who are users in the portal","meeting","false","","false","true","false","true","false","true","HubSpot","Inbounddb lists (4); Automation platform flow (1); Report (1)","16.58%","",""
"Contact first outreach date","hs_contact_first_outreach_date","datetime","The first outreach date of the associated contact","meeting","false","","true","true","false","false","false","true","HubSpot","Sales view (1)","91.58%","",""
"Internal Meeting Notes","hs_internal_meeting_notes","string","The internal notes from the meeting","meeting","false","","false","true","false","false","false","true","HubSpot","Automation platform flow (4); Report (3); Sales view (5)","39.2%","",""
"Meeting description","hs_meeting_body","string","The text description of the meeting","meeting","false","","false","true","false","false","false","true","HubSpot","Automation platform flow (3); Report (2); Sales view (8)","75.84%","",""
"Meeting end time","hs_meeting_end_time","datetime","The date when the meeting ends","meeting","false","","false","true","false","false","false","true","HubSpot","Calculated property (1); Rollup property (3); Sales view (3)","99.77%","",""
"Meeting location","hs_meeting_location","string","Where the meeting takes place","meeting","false","","false","true","false","false","false","true","HubSpot","Report (6); Sales view (5)","52.98%","",""
"Location type","hs_meeting_location_type","enumeration","The type of location for the meeting event","meeting","false","Phone call (PHONE); Address (ADDRESS); Custom (CUSTOM); Video Conference (VCE)","false","true","false","false","false","true","HubSpot","","1.27%","",""
"Meeting outcome","hs_meeting_outcome","enumeration","The outcome of this meeting","meeting","false","Scheduled (SCHEDULED); Completed (COMPLETED); Rescheduled (RESCHEDULED); No Show (NO_SHOW); Canceled (CANCELED); Completed Onsite (COMPLETED ONSITE)","false","true","false","false","false","true","HubSpot","Inbounddb lists (9); Automation platform flow (6); Report (28); Dataset (3); Sales view (4)","57.97%","",""
"Meeting source","hs_meeting_source","enumeration","The source where the meeting was booked","meeting","false","CRM UI (CRM_UI); Integration (INTEGRATION); Meeting created from a proposed time (AVAILABILITY_SCHEDULE); Meeting created on calendar from CRM (BIDIRECTIONAL_API); Meeting synced from calendar to CRM (BIDIRECTIONAL_SYNC); Meetings (Embedded) (MEETINGS_EMBEDDED); Meetings (Public) (MEETINGS_PUBLIC)","true","true","false","false","false","true","HubSpot","Rollup property (3); Automation platform flow (1); Report (8); Sales view (5)","97.47%","",""
"Meeting start time","hs_meeting_start_time","datetime","The date when the meeting starts","meeting","false","","false","true","false","false","false","true","HubSpot","Calculated property (1); Rollup property (5); Inbounddb lists (10); Automation platform flow (7); Report (52); Dataset (1); Sales view (8)","100%","",""
"Meeting name","hs_meeting_title","string","The title of the meeting","meeting","false","","false","true","false","false","false","true","HubSpot","Rollup property (1); Automation platform flow (6); Report (13); Dataset (1); Sales view (8)","85.92%","",""
"Outcome canceled count","hs_outcome_canceled_count","number","1 if outcome is canceled otherwise 0","meeting","false","","true","true","false","false","false","true","HubSpot","","100%","",""
"Outcome completed count","hs_outcome_completed_count","number","1 if outcome is completed otherwise 0","meeting","false","","true","true","false","false","false","true","HubSpot","Report (26); Dataset (3)","100%","",""
"Outcome no show count","hs_outcome_no_show_count","number","1 if outcome is no-show otherwise 0","meeting","false","","true","true","false","false","false","true","HubSpot","","100%","",""
"Outcome rescheduled count","hs_outcome_rescheduled_count","number","1 if outcome is rescheduled otherwise 0","meeting","false","","true","true","false","false","false","true","HubSpot","","100%","",""
"Outcome scheduled count","hs_outcome_scheduled_count","number","1 if outcome is scheduled otherwise 0","meeting","false","","true","true","false","false","false","true","HubSpot","","100%","",""
"Time to book meeting from first contact","hs_time_to_book_meeting_from_first_contact","number","The time it took to book a meeting from first outreach date of the associated contact","meeting","false","","true","true","false","false","false","true","HubSpot","","99.87%","",""
"Video conference platform","hs_video_conference_platform","enumeration","The video conference platform (Zoom, Teams, or Google Meet) that the video conference URL (hs_video_conference_url) is hosted on","meeting","false","Google Meet (google_meet); Zoom (zoom); Microsoft Teams (microsoft_teams); Other (other)","true","true","false","false","false","true","HubSpot","Sales view (1)","38.95%","",""
"Video conference url","hs_video_conference_url","string","Optional property storing the video conference url for an online meeting","meeting","false","","true","true","false","false","false","true","HubSpot","Sales view (2)","51.47%","",""
"Meeting Tag","meeting_tag","enumeration","","meeting","true","Inbound - Paid (Inbound); Inbound - Organic; IG Outreach; Live Events","false","false","false","false","false","false","Nay Luchetti","Sales view (1)","1.34%","",""
"Associated Contact Conversion","associated_contact_conversion","string","","meetingeventinformation","false","","true","false","true","false","false","false","Nay Luchetti","Sales view (1)","38.16%","",""
"Associated Contact Conversion Date","associated_contact_conversion_date","datetime","","meetingeventinformation","false","","true","false","true","false","false","false","Nay Luchetti","Sales view (1)","38.16%","",""
"Associated Contact Source","associated_contact_source","enumeration","","meetingeventinformation","false","Organic Search (ORGANIC_SEARCH); Paid Search (PAID_SEARCH); Email Marketing (EMAIL_MARKETING); Organic Social (SOCIAL_MEDIA); Referrals (REFERRALS); Other Campaigns (OTHER_CAMPAIGNS); Direct Traffic (DIRECT_TRAFFIC); Offline Sources (OFFLINE); Paid Social (PAID_SOCIAL); AI Referrals (AI_REFERRALS)","true","false","true","false","false","false","Nay Luchetti","Sales view (1)","91.58%","",""
"Created by user ID","hs_created_by_user_id","number","The user who created this record. This value is set automatically by HubSpot.","meetingeventinformation","false","","true","true","false","true","false","true","HubSpot","Inbounddb lists (1); Report (9)","96.95%","",""
"Merged record IDs","hs_merged_object_ids","enumeration","The list of record IDs that have been merged into this record. This value is set automatically by HubSpot.","meetingeventinformation","false","","true","true","false","true","false","true","HubSpot","","0%","",""
"Record ID","hs_object_id","number","The unique ID for this record. This value is set automatically by HubSpot.","meetingeventinformation","false","","true","true","false","false","false","true","HubSpot","Rollup property (1); Report (32); Dataset (4); Pipeline object tag (1)","100%","",""
"Record source detail 1","hs_object_source_detail_1","string","First level of detail on how this record was created.","meetingeventinformation","false","","true","true","false","false","false","true","HubSpot","","3.63%","",""
"Record source detail 2","hs_object_source_detail_2","string","Second level of detail on how this record was created.","meetingeventinformation","false","","true","true","false","false","false","true","HubSpot","","0%","",""
"Record source detail 3","hs_object_source_detail_3","string","Third level of detail on how this record was created.","meetingeventinformation","false","","true","true","false","false","false","true","HubSpot","","0%","",""
"Record source","hs_object_source_label","enumeration","How this record was created.","meetingeventinformation","false","","true","true","false","true","false","true","HubSpot","Report (4)","97.53%","",""
"Updated by user ID","hs_updated_by_user_id","number","The user who last updated this record. This value is set automatically by HubSpot.","meetingeventinformation","false","","true","true","false","true","false","true","HubSpot","","98.23%","",""
"Meeting Duration","meeting_duration","number","","meetingeventinformation","false","","true","false","true","false","false","false","Nay Luchetti","Sales view (2)","99.77%","",""
